{
  "event_id": "evt-123",
  "occurred_at": "2026-08-19T10:00:00Z",
  "device": {
    "host_name": "developer-mac",
    "platform": "macos",
    "os_version": "15.6"
  },
  "agent": {
    "name": "codex",
    "version": "1.2.3"
  },
  "session_id": "session-123",
  "response_id": "resp-123",
  "previous_response_id": "resp-122",
  "subagent_id": "agent-2",
  "parent_subagent_id": "agent-1",
  "root_turn_id": "turn-1",
  "purpose": "session_title",
  "llm": {
    "provider": "openai",
    "model": "gpt-5"
  },
  "side": "response",
  "token_usage": {
    "input_tokens": 0,
    "output_tokens": 12,
    "cache_read_tokens": 0,
    "cache_write_tokens": 0,
    "reasoning_tokens": 4,
    "total_tokens": 12
  },
  "attachments": [
    {
      "position": 0,
      "media_type": "image/png",
      "byte_size": 8,
      "sha256": "0000000000000000000000000000000000000000000000000000000000000000",
      "content_base64": "iVBORw0KGgo="
    }
  ],
  "conversation": {
    "entries": [
      {
        "role": "reasoning",
        "text": "The user wants an overview of the repository.",
        "item_id": "rs-123"
      },
      {
        "role": "assistant",
        "text": "I will inspect the repository.",
        "item_id": "msg-123"
      },
      {
        "role": "tool_call",
        "text": "pwd",
        "call_id": "call-123",
        "name": "exec",
        "item_id": "fc-123"
      }
    ],
    "completeness": "complete"
  },
  "headers": [
    {
      "name": "content-type",
      "value": "text/event-stream"
    },
    {
      "name": "x-request-id",
      "value": "req-123"
    },
    {
      "name": "set-cookie",
      "value": "<redacted>"
    }
  ]
}
